id,title,score,num_comments,author,created_utc,url,over_18,edited,spoiler,stickied
1d0baur,Pat Cummins Leads Team to Finals in First Three Attempts as Captain!,1153,145,VijayXD,2024-05-25 12:48:15,https://i.redd.it/ognzwtjwjk2d1.jpeg,False,False,False,False
1d054pg,What makes Pat Cummins a great captain?,1100,322,kiddmercury,2024-05-25 05:46:56,https://i.redd.it/jfgarcjqgi2d1.jpeg,False,False,False,False
1d0h81w,Bangladesh wins the third t20i to avoid a whitewash against the USA,477,62,Necessary-Ant1346,2024-05-25 17:39:26,https://i.redd.it/jz3xek7vzl2d1.jpeg,False,False,False,False
1d0ctp8,MOST 6s CONCEDED IN AN IPL SEASON. ,311,45,Novel_Preference_746,2024-05-25 14:07:46,https://i.redd.it/tby3ivq3yk2d1.png,False,False,False,False
1d0g55i,Mustafizur Rahman picks up his best T20I figures of 6-10 in 4 overs which included a maiden,312,22,NoQuestion4045,2024-05-25 16:48:23,https://i.redd.it/f8g0f3mrql2d1.jpeg,False,False,False,False
1d06xbq,"Shakib makes U-turn on previous comment, says every team ‘very much equal’ in T20Is",300,81,ll--o--ll,2024-05-25 07:51:22,https://www.tbsnews.net/sports/shakib-makes-u-turn-previous-comment-says-every-team-very-much-equal-t20is-859136,False,False,False,False
1d0agoz,Pat Cummins and Shreyas Iyer with the IPL Trophy ahead of the Final,272,40,Truthgamer2,2024-05-25 12:00:22,https://i.redd.it/nj62jxldbk2d1.jpeg,False,False,False,False
1d0cdc2,Got Picked For 2022 T20 World Cup Because of RCB Fans: Dinesh Karthik,246,44,ll--o--ll,2024-05-25 13:44:57,https://www.news18.com/cricket/got-picked-for-2022-t20-world-cup-because-of-rcb-fans-dinesh-karthik-8903727.html,False,False,False,False
1d0ef4v,Shakib Al Hasan is now the only cricketer with 14000+ runs and 700+ wickets,227,26,Monirul-Haque,2024-05-25 15:25:48,https://i.redd.it/e5ux0201cl2d1.jpeg,False,False,False,False
1d08tli,USA revealed their Jersey at an Astro's game,186,70,Rossifan1782,2024-05-25 10:10:54,https://www.reddit.com/gallery/1d08tli,False,False,False,False
1d0axfw,Match Thread: 2nd T20I - England vs Pakistan,178,3014,CricketMatchBot,2024-05-25 12:27:34,https://www.reddit.com/r/Cricket/comments/1d0axfw/match_thread_2nd_t20i_england_vs_pakistan/,False,False,False,False
1d0ele5,Ben Stokes follows up his 5-fer in the last county game with two 4-fers against Somerset ,173,26,harshmangat,2024-05-25 15:34:13,https://i.redd.it/trotqp6jdl2d1.jpeg,False,False,False,False
1d04qi7,Why the star-obsessed Indian cricket needs commoner coach Gautam Gambhir?,160,119,ll--o--ll,2024-05-25 05:20:42,https://indianexpress.com/article/sports/ipl/why-the-star-obsessed-indian-cricket-needs-commoner-coach-gautam-gambhir-9350818/,False,False,False,False
1d0g83d,"Shreyas Iyer on his back issues: 'I raised my concern, no one was agreeing'",153,26,HopiumInhaler,2024-05-25 16:52:08,https://www.espncricinfo.com/story/ipl-2024-final-shreyas-iyer-on-his-back-issues-i-raised-my-concern-no-one-was-agreeing-1435288,False,False,False,False
1d07dki,Moeen ready to lead at World Cup if Buttler absent,143,42,warp-factor,2024-05-25 08:24:13,https://www.bbc.co.uk/sport/cricket/articles/c4nnxvz57k9o,False,False,False,False
1d0h2wx,"Jos Buttler joins the elite group of batters to have scored 3,000 T20i runs",135,29,Battleheros,2024-05-25 17:32:35,https://i.redd.it/0j16nt6nyl2d1.png,False,False,False,False
1d08i61,Pat Cummins on Australia's recent dominant run across formats: 'Been really lucky' - India Today ,126,9,thefuzzyflask,2024-05-25 09:48:25,https://www.indiatoday.in/sports/cricket/story/pat-cummins-on-australias-recent-dominant-run-in-international-cricket-2543712-2024-05-25,False,False,False,False
1d051pf,IPL 2024: Rajasthan Royals’ Hetmyer fined for breaching IPL Code of Conduct,105,13,peterianchimes,2024-05-25 05:41:28,https://sportstar.thehindu.com/cricket/ipl/ipl-news/shimron-hetmyer-srh-vs-rr-qualifier-2-ipl-2024-fine-code-of-conduct-rajasthan-royals-sunrisers-hyderabad-news/article68214221.ece,False,False,False,False
1d0arfu,Shaheen Afridi rejects Pakistan vice-captaincy offer,79,9,GentleClasher101,2024-05-25 12:18:00,https://www.espncricinfo.com/story/shaheen-afridi-rejects-pakistan-vice-captaincy-offer-1435278,False,False,False,False
1d0h4hv,England beat Pakistan by 23 runs in the second T201 and take a 1-0 lead in the four-match T201 series.,85,14,Battleheros,2024-05-25 17:34:40,https://i.redd.it/95ayqbn0zl2d1.png,False,False,False,False
1d0jc3l,Imagine Dragons to perform at the IPL closing ceremony,95,15,Kagura-Yato,2024-05-25 19:18:19,https://www.livemint.com/sports/cricket-news/kkr-vs-srh-ipl-2024-imagine-dragons-to-perform-at-closing-ceremony-confirms-dan-reynolds-11716649304586.html,False,False,False,False
1d0gao6,Post Match Thread: England vs Pakistan,65,56,CricketMatchBot,2024-05-25 16:55:33,https://www.reddit.com/r/Cricket/comments/1d0gao6/post_match_thread_england_vs_pakistan/,False,False,False,False
1d0kbkc,'I'd Take in a Heartbeat': Graeme Swann Ready to Accept Coaching Role for Indian Cricket Team,71,19,ll--o--ll,2024-05-25 20:05:08,https://www.news18.com/cricket/id-take-in-a-heartbeat-former-england-international-ready-to-accept-coaching-role-for-indian-cricket-team-8904253.html,False,False,False,False
1d0lth4,a short film about gay cricketers,49,1,ValuableTaste2826,2024-05-25 21:18:12,https://www.reddit.com/r/Cricket/comments/1d0lth4/a_short_film_about_gay_cricketers/,False,False,False,False
1d0hnlw,Match Thread: 2nd T20I - West Indies vs South Africa,41,383,CricketMatchBot,2024-05-25 18:00:20,https://www.reddit.com/r/Cricket/comments/1d0hnlw/match_thread_2nd_t20i_west_indies_vs_south_africa/,False,False,False,False
1d0k94n,Why cricket needs to pitch its growth plan to Chinese Australians,38,9,ll--o--ll,2024-05-25 20:02:00,https://www.smh.com.au/sport/cricket/why-cricket-needs-to-pitch-its-growth-plan-to-chinese-australians-20240523-p5jg6r.html?ref=rss&utm_medium=rss&utm_source=rss_sport,False,False,False,False
1d09425,what if cricket had to announce 15 men squads for a historical world cup? (creative oc),38,115,Boysenberrryy,2024-05-25 10:32:06,https://www.reddit.com/gallery/1d09425,False,False,False,False
1d0kxmx,Jos Buttler is the PLAYER OF THE MATCH in PAK VS ENG 2nd T20i,32,3,Battleheros,2024-05-25 20:35:31,https://i.redd.it/amx9oc8avm2d1.jpeg,False,False,False,False
1d0crna,Match Thread: 3rd T20I - United States of America vs Bangladesh,30,115,CricketMatchBot,2024-05-25 14:04:52,https://www.reddit.com/r/Cricket/comments/1d0crna/match_thread_3rd_t20i_united_states_of_america_vs/,False,False,False,False
1d0fg8r,"T20 World Cup: Pakistan's Biggest Chink Is Always Going To Be Fielding, Says Matthew Hayden ",26,3,kundu123,2024-05-25 16:15:20,https://sports.ndtv.com/t20-world-cup-2024/t20-world-cup-pakistans-biggest-chink-is-always-going-to-be-fielding-says-matthew-hayden-5744018,False,False,False,False
1d0flaa,I was definitely struggling after World Cup: Shreyas Iyer,24,1,polopiko,2024-05-25 16:21:57,https://www.cricbuzz.com/cricket-news/130520/i-was-definitely-struggling-after-world-cup-shreyas-iyer,False,False,False,False
1d0copb,US Ambassador Eric Garcetti cheers India's Blind Cricket Team in Bengaluru,26,2,Kathanayagan-3821,2024-05-25 14:00:57,https://www.hindustantimes.com/cricket/us-ambassador-eric-garcetti-cheers-india-s-blind-cricket-team-in-bengaluru-101716641403782.html,False,False,False,False
1d0t6z5,IPL FINAL SLEDGE THREAD: KKR VS SRH,41,108,rinkusingh66666,2024-05-26 04:07:42,https://www.reddit.com/r/Cricket/comments/1d0t6z5/ipl_final_sledge_thread_kkr_vs_srh/,False,False,False,False
1d0qqp6,"First batch of Indian players, including Rohit Sharma, Jasprit Bumrah and Suryakumar Yadav, depart for US ahead of T20 World Cup",25,4,JKKIDD231,2024-05-26 01:39:01,https://timesofindia.indiatimes.com/sports/cricket/icc-mens-t20-world-cup/first-batch-of-indian-players-including-rohit-sharma-jasprit-bumrah-and-suryakumar-yadav-depart-for-us-ahead-of-t20-world-cup/articleshow/110426401.cms,False,False,False,False
1d07zyl,"Dutta back for Canada, Dassanayake reinstated as coach",15,4,styxwade,2024-05-25 09:10:15,https://m.cricbuzz.com/cricket-news/130514/dutta-returns-for-canada-dassanayake-to-stay-on-as-coach,False,False,False,False
1d07vgb,Match Thread: County Championship - Round 8 - Day 2,16,116,warp-factor,2024-05-25 09:01:26,https://www.reddit.com/r/Cricket/comments/1d07vgb/match_thread_county_championship_round_8_day_2/,False,False,False,False
1d081gc,Jos Buttler to keep wicket and captain at World Cup despite over-rate concerns - ICC clamp-down on tardiness in field puts focus on Moeen as deputy,15,3,warp-factor,2024-05-25 09:13:24,https://www.espncricinfo.com/story/t20-world-cup-jos-buttler-to-keep-wicket-and-captain-despite-over-rate-concerns-1435170,False,False,False,False
1d06dd3,"Jake’s no fake in IPL – but putting together a team is different matter
",15,2,ll--o--ll,2024-05-25 07:10:36,https://www.theaustralian.com.au/sport/cricket/jakes-no-fake-in-ipl-but-putting-together-a-team-is-different-matter/news-story/6845ae0c301485cbc43f4b9099e6c362?amp,False,False,False,False
1d0rlpj,"Daily General Discussion and Match Links Thread - May 26, 2024",12,78,AutoModerator,2024-05-26 02:30:10,https://www.reddit.com/r/Cricket/comments/1d0rlpj/daily_general_discussion_and_match_links_thread/,False,False,False,True
1d0pw47,2024 ICC Men's T20 World Cup [Preview #7] - Uganda,10,2,Tern_Larvidae-2424,2024-05-26 00:49:24,https://www.reddit.com/r/Cricket/comments/1d0pw47/2024_icc_mens_t20_world_cup_preview_7_uganda/,False,False,False,False
1d0alq4,Match Thread: 2nd T20I - Austria vs Belgium,9,1,CricketMatchBot,2024-05-25 12:08:20,https://www.reddit.com/r/Cricket/comments/1d0alq4/match_thread_2nd_t20i_austria_vs_belgium/,False,False,False,False
1d079bk,Match Thread: 1st T20I - Austria vs Belgium,7,2,CricketMatchBot,2024-05-25 08:15:40,https://www.reddit.com/r/Cricket/comments/1d079bk/match_thread_1st_t20i_austria_vs_belgium/,False,False,False,False
1d0t2bg,T20 World Cup: Virat Kohli may miss India’s only warm up game after taking a mini-break post IPL,33,41,ll--o--ll,2024-05-26 04:00:32,https://indianexpress.com/article/sports/cricket/t20-world-cup-virat-kohli-miss-india-warmup-match-ipl-2024-sanju-pandya-9352086/,False,False,False,False
1d0k8g2,"Change is coming for Pat Cummins's Test team, but are they ready for it?",6,9,ll--o--ll,2024-05-25 20:01:11,https://www.abc.net.au/news/2024-05-26/the-test-of-time-facing-australias-ageing-mens-cricket-team/103863356,False,False,False,False
1d0cnf4,County contracts for international players,4,6,TallBritNE,2024-05-25 13:59:21,https://www.reddit.com/r/Cricket/comments/1d0cnf4/county_contracts_for_international_players/,False,False,False,False
1d0bt58,Match Thread: 6th Match - Romania vs Gibraltar,5,1,CricketMatchBot,2024-05-25 13:15:43,https://www.reddit.com/r/Cricket/comments/1d0bt58/match_thread_6th_match_romania_vs_gibraltar/,False,False,False,False
1d05q6q,"""We need 18 counties"" ⏤ In conversation with Richard Gould",4,0,AnalogueInterfa3e,2024-05-25 06:26:26,https://youtu.be/Zewk0_KWbDA?si=q8k8qVu8pX_1Yt8l,False,False,False,False
1d0n111,IPL 2024 Final Date: Kolkata Knight Riders Vs. Sunrisers Hyderabad - 360 Tech Planet,3,0,Robert_Weasley,2024-05-25 22:17:18,https://360techplanet.com/ipl-2024-final-date-kkr-vs-srh/,False,False,False,False
1d0k9hy,'No Offer Was Made' - PCB Deny Reports Shaheen Turned Down Pakistan Vice-Captaincy,3,3,ll--o--ll,2024-05-25 20:02:27,https://wisden.com/series-stories/t20-world-cup-2024/no-offer-was-made-pcb-deny-reports-shaheen-turned-down-vice-captaincy,False,False,False,False
1d0rnkx,Selector Sunday Thread,2,1,AutoModerator,2024-05-26 02:33:06,https://www.reddit.com/r/Cricket/comments/1d0rnkx/selector_sunday_thread/,False,False,False,True
1d0oy7r,Rec/Pickup Cricket in NYC area,1,0,basuklorax,2024-05-25 23:56:32,https://www.reddit.com/r/Cricket/comments/1d0oy7r/recpickup_cricket_in_nyc_area/,False,False,False,False
1d05x68,A prime example of South African way to lose cricket matches,1,0,kundu123,2024-05-25 06:39:36,https://m.cricbuzz.com/cricket-news/130504/a-prime-example-of-south-african-way-to-lose-cricket-matches,False,False,False,False
